[
  {
    "id": "T02.GK.01",
    "title": "Follow the Arrow Cards",
    "short_name": "Follow 3-step arrow picture sequence",
    "topic_id": "T02",
    "grade": "K",
    "skill_type": "picture_based_digital",
    "activity_type": "click_select",
    "description_teacher": "Students view a simple 3-arrow sequence (up, right, down) and click where a character would end up on a grid. Introduces the concept that pictures can represent directions.",
    "student_prompt": "The robot follows these arrows. Where does it end up?",
    "student_prompt_audio": {
      "tts_text": "The robot follows these arrows. Where does it end up?",
      "voice_settings": {
        "speed": "normal",
        "voice_type": "child_friendly"
      }
    },
    "interaction_details": {
      "item_count": 4,
      "interaction_mode": "click_items",
      "visual_theme": "robots_technology",
      "estimated_time_minutes": 2,
      "randomization": {
        "enabled": true,
        "randomize_items": false
      }
    },
    "auto_grade_rules": {
      "type": "single_choice",
      "correct_answer": "position_3",
      "partial_credit": {
        "enabled": false
      },
      "feedback": {
        "correct": {
          "message": "Yes! The robot goes up, right, then down!",
          "audio_tts": "Yes! The robot goes up, right, then down!",
          "visual_effect": "stars"
        },
        "incorrect": {
          "message": "Try again! Follow each arrow one at a time.",
          "audio_tts": "Try again! Follow each arrow one at a time.",
          "hint_provided": true,
          "hint_text": "Start at the robot and follow: up, right, down"
        }
      },
      "retry_logic": {
        "max_attempts": 3,
        "show_correct_answer": true,
        "reset_on_retry": false
      }
    },
    "accessibility": {
      "audio_support": true,
      "keyboard_navigable": true,
      "screen_reader_compatible": true,
      "touch_target_size": "extra_large",
      "color_blind_safe": true,
      "high_contrast_mode": true,
      "language_support": ["en"]
    },
    "dependencies": [],
    "csta_code": "1A-AP-08"
  },
  {
    "id": "T02.GK.02",
    "title": "Match the Path to the Arrow Cards",
    "short_name": "Match picture algorithm to outcome",
    "topic_id": "T02",
    "grade": "K",
    "skill_type": "picture_based_digital",
    "activity_type": "match_pairs",
    "description_teacher": "Students match 3 simple arrow sequences to pictures showing where a character ends up. Reinforces that sequences of picture symbols produce specific outcomes.",
    "student_prompt": "Match each set of arrows to where the bunny ends up!",
    "student_prompt_audio": {
      "tts_text": "Match each set of arrows to where the bunny ends up!",
      "voice_settings": {
        "speed": "normal",
        "voice_type": "child_friendly"
      }
    },
    "interaction_details": {
      "item_count": 6,
      "interaction_mode": "draw_lines",
      "visual_theme": "animals_nature",
      "estimated_time_minutes": 3,
      "randomization": {
        "enabled": true,
        "randomize_positions": true
      }
    },
    "auto_grade_rules": {
      "type": "pair_match",
      "correct_answer": {
        "arrows_up_right": "position_north_east",
        "arrows_down_left": "position_south_west",
        "arrows_right_right": "position_east"
      },
      "partial_credit": {
        "enabled": false
      },
      "feedback": {
        "correct": {
          "message": "Perfect! You matched all the paths!",
          "audio_tts": "Perfect! You matched all the paths!",
          "visual_effect": "confetti"
        },
        "incorrect": {
          "message": "Try again! Follow each arrow to see where it goes.",
          "audio_tts": "Try again! Follow each arrow to see where the bunny goes.",
          "hint_provided": true,
          "hint_text": "Start at the bunny and follow each arrow in order"
        }
      },
      "retry_logic": {
        "max_attempts": 3,
        "show_correct_answer": true,
        "reset_on_retry": true
      }
    },
    "accessibility": {
      "audio_support": true,
      "keyboard_navigable": true,
      "screen_reader_compatible": true,
      "touch_target_size": "extra_large",
      "color_blind_safe": true,
      "high_contrast_mode": true,
      "language_support": ["en"]
    },
    "dependencies": ["T02.GK.01"],
    "csta_code": "1A-AP-08"
  },
  {
    "id": "T02.GK.03",
    "title": "Help the Cat Find the Food",
    "short_name": "Create simple 3-arrow path with pictures",
    "topic_id": "T02",
    "grade": "K",
    "skill_type": "picture_based_digital",
    "activity_type": "drag_drop_sequence",
    "description_teacher": "Students drag 3 arrow cards into order to help a cat reach its food bowl on a simple grid. First experience creating a picture algorithm.",
    "student_prompt": "Drag the arrows to help the cat reach the food!",
    "student_prompt_audio": {
      "tts_text": "Drag the arrows to help the cat reach the food!",
      "voice_settings": {
        "speed": "normal",
        "voice_type": "child_friendly"
      }
    },
    "interaction_details": {
      "item_count": 3,
      "interaction_mode": "drag_to_slots",
      "visual_theme": "animals_pets",
      "estimated_time_minutes": 3,
      "randomization": {
        "enabled": true,
        "randomize_positions": true
      }
    },
    "auto_grade_rules": {
      "type": "sequence_order",
      "correct_answer": ["right", "up", "right"],
      "partial_credit": {
        "enabled": false
      },
      "feedback": {
        "correct": {
          "message": "Great! The cat got to the food!",
          "audio_tts": "Great! The cat got to the food!",
          "visual_effect": "stars"
        },
        "incorrect": {
          "message": "Not quite! Try a different path.",
          "audio_tts": "Not quite! Try a different path to reach the food.",
          "hint_provided": true,
          "hint_text": "The cat needs to go right, then up, then right again"
        }
      },
      "retry_logic": {
        "max_attempts": 3,
        "show_correct_answer": true,
        "reset_on_retry": true
      }
    },
    "accessibility": {
      "audio_support": true,
      "keyboard_navigable": true,
      "screen_reader_compatible": true,
      "touch_target_size": "extra_large",
      "color_blind_safe": true,
      "high_contrast_mode": true,
      "language_support": ["en"]
    },
    "dependencies": ["T02.GK.02"],
    "csta_code": "1A-AP-08"
  },
  {
    "id": "T02.G1.01",
    "title": "Trace the Path Through the Grid",
    "short_name": "Trace path using 4-5 picture symbols",
    "topic_id": "T02",
    "grade": "1",
    "skill_type": "picture_based_digital",
    "activity_type": "path_tracing",
    "description_teacher": "Students follow a 4-5 arrow sequence to trace a path through a 5x5 grid from start to finish, clicking each square along the way.",
    "student_prompt": "Follow the arrows to trace the path!",
    "student_prompt_audio": {
      "tts_text": "Follow the arrows to trace the path from start to finish!",
      "voice_settings": {
        "speed": "normal",
        "voice_type": "child_friendly"
      }
    },
    "interaction_details": {
      "item_count": 5,
      "interaction_mode": "tap_sequence",
      "visual_theme": "treasure_maps",
      "estimated_time_minutes": 3,
      "randomization": {
        "enabled": true,
        "randomize_items": true
      }
    },
    "auto_grade_rules": {
      "type": "sequence_order",
      "correct_answer": ["A1", "A2", "B2", "C2", "C3"],
      "partial_credit": {
        "enabled": false
      },
      "feedback": {
        "correct": {
          "message": "Perfect! You followed the arrows correctly!",
          "audio_tts": "Perfect! You followed the arrows correctly!",
          "visual_effect": "stars"
        },
        "incorrect": {
          "message": "Try again! Follow each arrow carefully.",
          "audio_tts": "Try again! Follow each arrow carefully one at a time.",
          "hint_provided": true,
          "hint_text": "Start at the green square and move one square for each arrow"
        }
      },
      "retry_logic": {
        "max_attempts": 3,
        "show_correct_answer": true,
        "reset_on_retry": true
      }
    },
    "accessibility": {
      "audio_support": true,
      "keyboard_navigable": true,
      "screen_reader_compatible": true,
      "touch_target_size": "large",
      "color_blind_safe": true,
      "high_contrast_mode": true,
      "language_support": ["en"]
    },
    "dependencies": [],
    "csta_code": "1A-AP-08"
  },
  {
    "id": "T02.G1.02",
    "title": "Create the Path to the Treasure",
    "short_name": "Create picture algorithm for 4-step path",
    "topic_id": "T02",
    "grade": "1",
    "skill_type": "picture_based_digital",
    "activity_type": "drag_drop_sequence",
    "description_teacher": "Students drag 4 arrow cards into sequence to create a path from a pirate to treasure on a grid. Practices creating picture-based algorithms.",
    "student_prompt": "Drag the arrows to help the pirate reach the treasure!",
    "student_prompt_audio": {
      "tts_text": "Drag the arrows to help the pirate reach the treasure!",
      "voice_settings": {
        "speed": "normal",
        "voice_type": "child_friendly"
      }
    },
    "interaction_details": {
      "item_count": 4,
      "interaction_mode": "drag_to_slots",
      "visual_theme": "pirates_treasure",
      "estimated_time_minutes": 3,
      "randomization": {
        "enabled": true,
        "randomize_positions": true
      }
    },
    "auto_grade_rules": {
      "type": "sequence_order",
      "correct_answer": ["right", "right", "up", "left"],
      "partial_credit": {
        "enabled": false
      },
      "feedback": {
        "correct": {
          "message": "Awesome! The pirate found the treasure!",
          "audio_tts": "Awesome! The pirate found the treasure!",